{
  "adventurerId": "adventurer_002",
  "name": "Alex the Insipid",
  "level": 1,
  "maxHp": 80,
  "hp": 80,
  "maxTp": 50,
  "tp": 50,
  "power": 10,
  "defense": 10,
  "speed": 10,
  "evasion": 0.05,
  "critChance": 0.05,
  "critModifier": 0.5,
  "techsIds": ["fireblast"],
  "itemIds": [],
  "canFight": true
}
